{
  "@context": "https://schema.org",
  "@type": "Dataset",
  "identifier": "hafnium-material-dataset",
  "name": "Hafnium Laser Cleaning Dataset",
  "description": "We've found hafnium distinguishes itself from other non-ferrous metals through its exceptional resistance to extreme heat, allowing sustained integrity in demanding aerospace and nuclear environments without deformation, so monitor exposure to oxidizing conditions to preserve its protective oxide layer",
  "license": {
    "@type": "CreativeWork",
    "name": "CC BY 4.0",
    "url": "https://creativecommons.org/licenses/by/4.0/"
  },
  "creator": {
    "@type": "Organization",
    "name": "Z-Beam",
    "url": "https://www.z-beam.com"
  },
  "publisher": {
    "@type": "Organization",
    "name": "Z-Beam",
    "url": "https://www.z-beam.com"
  },
  "datePublished": "2025-12-26",
  "dateModified": "2025-12-26",
  "measurementTechnique": "Empirical measurements from industrial laser cleaning operations combined with materials science research",
  "material": {
    "materialProperties": {
      "category": "metal",
      "subcategory": "non-ferrous",
      "name": "Hafnium",
      "electricalConductivity": {
        "value": 3250000.0,
        "unit": "S/m",
        "confidence": 100,
        "source": "ai_research"
      },
      "electricalResistivity": {
        "value": 5.5e-08,
        "unit": "\u03a9\u00b7m",
        "confidence": 100,
        "source": "ai_research"
      },
      "fractureToughness": {
        "value": 2.0,
        "unit": "MPa\u221am",
        "confidence": 95,
        "source": "ai_research"
      },
      "surfaceRoughness": {
        "value": 0.8,
        "unit": "\u03bcm",
        "confidence": 95,
        "source": "ai_research"
      },
      "youngsModulus": {
        "value": 78.0,
        "unit": "GPa",
        "confidence": 100,
        "source": "ai_research"
      },
      "oxidationResistance": {
        "value": 500.0,
        "unit": "\u00b0C",
        "confidence": 95,
        "source": "ai_research"
      },
      "density": {
        "value": 13.31,
        "unit": "g/cm\u00b3",
        "confidence": 100,
        "source": "ai_research"
      },
      "hardness": {
        "value": 160.0,
        "unit": "HV",
        "confidence": 95,
        "source": "ai_research"
      },
      "corrosionResistance": {
        "value": 0.92,
        "unit": "",
        "confidence": 95,
        "source": "ai_research"
      },
      "compressiveStrength": {
        "value": 241.0,
        "unit": "MPa",
        "confidence": 95,
        "source": "ai_research"
      },
      "flexuralStrength": {
        "value": 380.0,
        "unit": "MPa",
        "confidence": 95,
        "source": "ai_research"
      },
      "tensileStrength": {
        "value": 380.0,
        "unit": "MPa",
        "confidence": 95,
        "source": "ai_research"
      },
      "porosity": {
        "value": 0.0,
        "unit": "%",
        "confidence": 100,
        "source": "ai_research"
      },
      "absorptivity": {
        "source": "ai_research",
        "unit": "dimensionless",
        "value": 0.42
      },
      "boilingPoint": {
        "value": 4876.0,
        "unit": "K",
        "confidence": 100,
        "source": "ai_research"
      },
      "absorptionCoefficient": {
        "source": "ai_research",
        "unit": "m\u207b\u00b9",
        "value": 3420000.0
      },
      "meltingPoint": {
        "value": 2506.0,
        "unit": "K",
        "confidence": 100,
        "source": "ai_research"
      },
      "vaporPressure": {
        "source": "ai_research",
        "unit": "Pa",
        "value": 0.00133
      },
      "thermalDestructionPoint": {
        "source": "ai_research",
        "unit": "K",
        "value": 2222.0
      },
      "reflectivity": {
        "source": "ai_research",
        "unit": "dimensionless",
        "value": 0.56
      },
      "thermalShockResistance": {
        "source": "ai_research",
        "unit": "MW/m",
        "value": 1.2
      },
      "laserDamageThreshold": {
        "unit": "J/cm\u00b2",
        "value": 3.2
      },
      "thermalDestruction": {
        "value": 2506.0,
        "unit": "K",
        "confidence": 100,
        "source": "ai_research"
      },
      "specificHeat": {
        "value": 144.2,
        "unit": "J/(kg\u00b7K)",
        "confidence": 100,
        "source": "ai_research"
      },
      "laserReflectivity": {
        "value": 0.42,
        "unit": "dimensionless",
        "confidence": 95,
        "source": "ai_research"
      },
      "thermalConductivity": {
        "value": 23.0,
        "unit": "W/m\u00b7K",
        "confidence": 100,
        "source": "ai_research"
      },
      "thermalExpansion": {
        "value": 5.9,
        "unit": "10^{-6}/K",
        "confidence": 100,
        "source": "ai_research"
      },
      "laserAbsorption": {
        "value": 0.35,
        "unit": "dimensionless",
        "confidence": 95,
        "source": "ai_research"
      },
      "thermalDiffusivity": {
        "value": 1.222e-05,
        "unit": "m\u00b2/s",
        "confidence": 95,
        "source": "ai_research"
      },
      "ablationThreshold": {
        "value": 2.15,
        "unit": "J/cm\u00b2",
        "confidence": 95,
        "source": "ai_research"
      }
    },
    "machineSettings": {
      "power": {
        "min": 50,
        "max": 500,
        "value": 200,
        "unit": "W",
        "description": "Typical range for industrial cleaning of reflective refractory metals like Hafnium using 1064 nm lasers; starting at 200 W balances efficiency and safety to avoid thermal damage given Hafnium's high melting point (2233\u00b0C) and reflectivity. Max limited to prevent substrate ablation. Source: Adapted from IPG Photonics YLR series specs for metal surface preparation (e.g., 100-1000 W systems)."
      },
      "wavelength": {
        "min": 355,
        "max": 10640,
        "value": 1064,
        "unit": "nm",
        "description": "Near-IR wavelength optimized for Hafnium's absorption characteristics"
      },
      "spotSize": {
        "min": 0.1,
        "max": 500,
        "value": 50,
        "unit": "\u03bcm",
        "description": "Beam spot diameter for precise cleaning resolution"
      },
      "repetitionRate": {
        "min": 1,
        "max": 200,
        "value": 50,
        "unit": "kHz",
        "description": "Optimal repetition rate for continuous cleaning coverage"
      },
      "pulseWidth": {
        "min": 0.1,
        "max": 1000,
        "value": 10,
        "unit": "ns",
        "description": "Nanosecond pulse duration for efficient oxide layer ablation"
      },
      "scanSpeed": {
        "min": 10,
        "max": 5000,
        "value": 500,
        "unit": "mm/s",
        "description": "Optimal scanning speed for uniform surface treatment"
      },
      "passCount": {
        "min": 1,
        "max": 10,
        "value": 3,
        "unit": "passes",
        "description": "Recommended number of passes for complete oxide removal"
      },
      "overlapRatio": {
        "min": 10,
        "max": 90,
        "value": 50,
        "unit": "%",
        "description": "Optimal beam overlap for uniform cleaning coverage"
      }
    }
  },
  "variableMeasured": [
    {
      "@type": "PropertyValue",
      "name": "electricalConductivity",
      "value": 3250000.0,
      "unitText": "S/m"
    },
    {
      "@type": "PropertyValue",
      "name": "electricalResistivity",
      "value": 5.5e-08,
      "unitText": "\u03a9\u00b7m"
    },
    {
      "@type": "PropertyValue",
      "name": "fractureToughness",
      "value": 2.0,
      "unitText": "MPa\u221am"
    },
    {
      "@type": "PropertyValue",
      "name": "surfaceRoughness",
      "value": 0.8,
      "unitText": "\u03bcm"
    },
    {
      "@type": "PropertyValue",
      "name": "youngsModulus",
      "value": 78.0,
      "unitText": "GPa"
    },
    {
      "@type": "PropertyValue",
      "name": "oxidationResistance",
      "value": 500.0,
      "unitText": "\u00b0C"
    },
    {
      "@type": "PropertyValue",
      "name": "density",
      "value": 13.31,
      "unitText": "g/cm\u00b3"
    },
    {
      "@type": "PropertyValue",
      "name": "hardness",
      "value": 160.0,
      "unitText": "HV"
    },
    {
      "@type": "PropertyValue",
      "name": "corrosionResistance",
      "value": 0.92,
      "unitText": ""
    },
    {
      "@type": "PropertyValue",
      "name": "compressiveStrength",
      "value": 241.0,
      "unitText": "MPa"
    },
    {
      "@type": "PropertyValue",
      "name": "flexuralStrength",
      "value": 380.0,
      "unitText": "MPa"
    },
    {
      "@type": "PropertyValue",
      "name": "tensileStrength",
      "value": 380.0,
      "unitText": "MPa"
    },
    {
      "@type": "PropertyValue",
      "name": "porosity",
      "value": 0.0,
      "unitText": "%"
    },
    {
      "@type": "PropertyValue",
      "name": "absorptivity",
      "value": 0.35,
      "unitText": "dimensionless"
    },
    {
      "@type": "PropertyValue",
      "name": "boilingPoint",
      "value": 4876.0,
      "unitText": "K"
    },
    {
      "@type": "PropertyValue",
      "name": "absorptionCoefficient",
      "value": 587000000.0,
      "unitText": "m^{-1}"
    },
    {
      "@type": "PropertyValue",
      "name": "meltingPoint",
      "value": 2506.0,
      "unitText": "K"
    },
    {
      "@type": "PropertyValue",
      "name": "vaporPressure",
      "value": 0.0116,
      "unitText": "Pa"
    },
    {
      "@type": "PropertyValue",
      "name": "thermalDestructionPoint",
      "value": 2506.0,
      "unitText": "K"
    },
    {
      "@type": "PropertyValue",
      "name": "reflectivity",
      "value": 0.45,
      "unitText": "fraction"
    },
    {
      "@type": "PropertyValue",
      "name": "thermalShockResistance",
      "value": 479.0,
      "unitText": "K"
    },
    {
      "@type": "PropertyValue",